author,poem name,age,type,question
SIR PHILIP SIDNEY,Eleventh Song,Renaissance,Love,"""Well, in absence this will die;
Leave to see, and leave to wonder.""
Absence sure will help, if I
Can learn how myself to sunder
From what in my heart doth lie."
THOMAS LODGE,Rosalinds Madrigal,Renaissance,Love,"Because a god.
Then sit thou safely on my knee,
And let thy bower my bosom be;
Lurk in mine eyes, I like of thee.
O Cupid, so thou pity me,"
EZRA POUND,The Seafarer,Modern,Nature,"Must bide above brine.
Neareth nightshade, snoweth from north,
Frost froze the land, hail fell on earth then
Corn of the coldest. Nathless there knocketh now
The heart's thought that I on high streams"
EDMUND SPENSER,from The Shepheardes Calender: April,Renaissance,Mythology & Folklore,"But when he sawe, how broade her beames did spredde,
         it did him amaze.
He blusht to see another Sunne belowe,
Ne durst againe his fyrye face out showe:
         Let him, if he dare,"
WALLACE STEVENS,Peter Quince at the Clavier,Modern,Love,"The touch of springs,
And found
Concealed imaginings.
She sighed,
For so much melody."
JOHN SKELTON,"Womanhood, wanton, ye want",Renaissance,Love,"I trust to quite you ere I die!
Your key is meet for every lock,
Your key is common and hangeth out;
Your key is ready, we need not knock,
Nor stand long wresting there about;"
CHRISTOPHER MARLOWE,Hero and Leander,Renaissance,Mythology & Folklore,"         The men of wealthy Sestos every year,
For his sake whom their goddess held so dear,
Rose-cheek'd Adonis, kept a solemn feast.
Thither resorted many a wandering guest
To meet their loves; such as had none at all"
SIR PHILIP SIDNEY,"Astrophil and Stella 41: Having this day my horse, my hand, my lance ",Renaissance,Love,"Think Nature me a man of arms did make.
How far they shot awry! The true cause is,
Stella look'd on, and from her heav'nly face
Sent forth the beams which made so fair my race."
"HENRY VIII, KING OF ENGLAND",If Love Now Reigned As It Hath Been,Renaissance,Love,"To lovers I put now sure this case:
Which of their loves doth get them grace?
And unto them which doth it know
Better than do I, I think it so."
RICHARD ALDINGTON,To a Greek Marble,Modern,Mythology & Folklore,"Of our loves in Phrygia,
The far ecstasy of burning noons
When the fragile pipes
Ceased in the cypress shade,
And the brown fingers of the shepherd"
WILLIAM BUTLER YEATS,When You Are Old,Modern,Love,"And paced upon the mountains overhead
And hid his face amid a crowd of stars."
EDMUND SPENSER,"from The Faerie Queene: Book I, Canto I",Renaissance,Mythology & Folklore,"Thy weaker Novice to performe thy will,
Lay forth out of thine everlasting scryne
The antique rolles, which there lye hidden still,
Of Faerie knights and fairest Tanaquill,
Whom that most noble Briton Prince so long"
JOHN DONNE,The Flea,Renaissance,Love,"Where we almost, nay more than married are.   
This flea is you and I, and this
Our mariage bed, and marriage temple is;   
Though parents grudge, and you, w'are met,   
And cloistered in these living walls of jet."
EDMUND SPENSER,Prothalamion,Renaissance,Mythology & Folklore,"The little daisy, that at evening closes,
The virgin lily, and the primrose true,
With store of vermeil roses,
To deck their bridegrooms' posies
Against the bridal day, which was not long:"
WILLIAM SHAKESPEARE,Sonnet 116: Let me not to the marriage of true minds,Renaissance,Love,"Love alters not with his brief hours and weeks,
But bears it out even to the edge of doom.
If this be error and upon me prov'd,
I never writ, nor no man ever lov'd."
LADY MARY WROTH,from Pamphilia to Amphilanthus: Song 5,Renaissance,Love,"Wherein I may least happy bee
    Thy favors soe estranging.
Blame thy self, and nott my folly,
Time gave time butt to bee holly;
    True love such ends best loveth"
CHRISTOPHER MARLOWE,Hero and Leander,Renaissance,Love,"As if another Pha{""e}ton had got
The guidance of the sun's rich chariot.
But far above the loveliest, Hero shin'd,
And stole away th' enchanted gazer's mind;
For like sea-nymphs' inveigling harmony,"
"HENRY VIII, KING OF ENGLAND",Green Groweth the Holly,Renaissance,Nature,"When flowers cannot be seen
And greenwood leaves be gone,
Now unto my lady
Promise to her I make,
From all other only"
EDMUND SPENSER,from The Shepheardes Calender: October,Renaissance,Nature,"Cuddie shall have a Kidde to store his farme.
CUDDIES EMBLEME
Agitante calescimus illo"
SIR PHILIP SIDNEY,"Astrophil and Stella 92: Be your words made, good sir, of Indian ware",Renaissance,Love,"Whereof, with whom, how often did she talk;
With what pastime time's journey she beguiled;
If her lips deign'd to sweeten my poor name.
Say all; and all well said, still say the same."
JOHN DONNE,Air and Angels,Renaissance,Love,"         And therefore what thou wert, and who,
                I bid Love ask, and now
That it assume thy body, I allow,
And fix itself in thy lip, eye, and brow.
Whilst thus to ballast love I thought,"
HART CRANE,from The Bridge: Southern Cross,Modern,Love,"The mind is churned to spittle, whispering hell.
I wanted you
 The embers of the Cross
Climbed by aslant and huddling aromatically.
It is blood to remember; it is fire"
EDMUND SPENSER,An Hymn In Honour Of Beauty,Renaissance,Love,"The duller earth it quick'neth with delight,
And lifeful spirits privily doth pour
Through all the parts, that to the looker's sight
They seem to please. That is thy sovereign might,
O Cyprian queen, which flowing from the beam"
SIR PHILIP SIDNEY,Ring Out Your Bells,Renaissance,Love,"Alas, I lie, rage hath this error bred;
Love is not dead;
Love is not dead, but sleepeth
In her unmatched mind,
Where she his counsel keepeth,"
IVOR GURNEY,Ballad of the Three Spectres,Modern,Mythology & Folklore,"One day hell freeze in mud to the marrow,
   Then look his last on Picardie.
Though bitter the word of these first twain
   Curses the third spat venomously;
Hell stay untouched till the wars last dawning"
MARIANNE MOORE,Black Earth,Modern,Nature,"Time, a substance
Needful as an instance
         Of the indestructibility of matter; it   
         Has looked at the electricity and at the earth-
Quake and is still"
EDGAR LEE MASTERS,Mrs. Meyers,Modern,Love,Love God and keep his commandments.
WILLIAM SHAKESPEARE,"Sonnet 29: When, in disgrace with fortune and mens eyes",Renaissance,Love,"(Like to the lark at break of day arising
From sullen earth) sings hymns at heavens gate;
       For thy sweet love remembered such wealth brings
       That then I scorn to change my state with kings."
WALLACE STEVENS,Peter Quince at the Clavier,Modern,Love,"Of a green evening, clear and warm,
She bathed in her still garden, while
The red-eyed elders, watching, felt
The basses of their beings throb
In witching chords, and their thin blood"
WILLIAM SHAKESPEARE,Sonnet 71: No longer mourn for me when I am dead,Renaissance,Love,"Do not so much as my poor name rehearse,
But let your love even with my life decay,
Lest the wise world should look into your moan, 
And mock you with me after I am gone."
EDMUND SPENSER,An Hymn In Honour Of Beauty,Renaissance,Love,"Work like impression in the looker's view?
Or why do not fair pictures like power shew,
In which oft-times we nature see of art
Excell'd, in perfect limning every part?
But ah, believe me, there is more than so,"
T. S. ELIOT,Preludes,Modern,Nature,"Impatient to assume the world.
I am moved by fancies that are curled
Around these images, and cling:
The notion of some infinitely gentle
Infinitely suffering thing."
T. S. ELIOT,The Love Song of J. Alfred Prufrock,Modern,Love,"And watched the smoke that rises from the pipes
Of lonely men in shirt-sleeves, leaning out of windows?...
I should have been a pair of ragged claws
Scuttling across the floors of silent seas.
And the afternoon, the evening, sleeps so peacefully!"
SIR WALTER RALEGH,"[Fortune Hath Taken Thee Away, My Love]",Renaissance,Love,"With wisdoms eyes had but blind Cupid seen,
Then had my love my love for ever been;
But love farewell; though fortune conquer thee,
No fortune base shall ever alter me."
T. S. ELIOT,The Love Song of J. Alfred Prufrock,Modern,Love,"But though I have wept and fasted, wept and prayed,
Though I have seen my head (grown slightly bald) brought in upon a platter,
I am no prophet  and heres no great matter;
I have seen the moment of my greatness flicker,
And I have seen the eternal Footman hold my coat, and snicker,"
MARIANNE MOORE,A Graveyard,Modern,Nature,"advances as usual, looking as if it were not that ocean in which dropped things are bound to sink
in which if they turn and twist, it is neither with volition nor consciousness."
LOUIS UNTERMEYER,Magic,Modern,Mythology & Folklore,"The rivers tiny canon
Stretched into dusky lands;
Like a dark and silent companion
Evening held out her hands.
Hushed were the dawns bravados;"
EDMUND SPENSER,Prothalamion,Renaissance,Mythology & Folklore,"Which said their bridal day should not be long.
And gentle echo from the neighbour ground
Their accents did resound.
So forth those joyous birds did pass along,
Adown the Lee, that to them murmured low,"
WILLIAM SHAKESPEARE,Song: When daisies pied and violets blue ,Renaissance,Nature,"      And merry larks are ploughmen's clocks,
When turtles tread, and rooks, and daws,
      And maidens bleach their summer smocks,
The cuckoo then, on every tree,
Mocks married men; for thus sings he,"
HART CRANE,For The Marriage of Faustus and Helen,Modern,Mythology & Folklore,"That world which comes to each of us alone.
Accept a lone eye riveted to your plane,
Bent axle of devotion along companion ways
That beat, continuous, to hourless days
One inconspicuous, glowing orb of praise."
WALLACE STEVENS,Thirteen Ways of Looking at a Blackbird,Modern,Nature,"VII
O thin men of Haddam,   
Why do you imagine golden birds?   
Do you not see how the blackbird   
Walks around the feet   "
EDMUND SPENSER,The Shepheardes Calender: January,Renaissance,Nature,"His kiddes, his cracknelles, and his early fruit.
Ah foolish Hobbinol, thy gyfts bene vayne:
Colin them gives to Rosalind againe.
I loue thilke lasse, (alas why doe I loue?)
And am forlorne, (alas why am I lorne?)"
E. E. CUMMINGS,[in Just-],Modern,Nature,"balloonMan          whistles
far
and
wee"
JOHN SKELTON,The Book of Phillip Sparrow,Renaissance,Mythology & Folklore,"Moderatly to take
This sorrow that I make
For Phylyp Sparowes sake!
So fervently I shake,
I fele my body quake;"
EDMUND SPENSER,Prosopopoia: or Mother Hubbard's Tale,Renaissance,Mythology & Folklore,"To forty pound, that then his youngest son
Shall twenty have, and twenty thou hast won:
Thou hast it won, for it is of frank gift,
And he will care for all the rest to shift,
Both that the bishop may admit of thee,"
EDMUND SPENSER,from The Shepheardes Calender: April,Renaissance,Nature,"So nowe fayre Rosalind hath bredde hys smart,
So now his frend is chaunged for a frenne.
THENOT
But if hys ditties bene so trimly dight,
I pray thee Hobbinoll, recorde some one:"
LOUISE BOGAN,Medusa,Modern,Mythology & Folklore,"Nothing will ever stir.
The end will never brighten it more than this,
Nor the rain blur.
The water will always fall, and will not fall,
And the tipped bell make no sound."
T. S. ELIOT,The Love Song of J. Alfred Prufrock,Modern,Love,"Time for you and time for me,
And time yet for a hundred indecisions,
And for a hundred visions and revisions,
Before the taking of a toast and tea.
In the room the women come and go"
FORD MADOX FORD,In October 1914 [Antwerp],Modern,Mythology & Folklore,"And the gray coat, and the large hat, and the hands behind the back, 
Watches them pass 
In our minds for ever
But that clutter of sodden corses 
On the sodden Belgian grass "
THOMAS CAMPION,Thrice Toss These Oaken Ashes,Renaissance,Love,"In vain are all the charms I can devise:
She hath an art to break them with her eyes."
EDMUND SPENSER,"from The Faerie Queene: Book I, Canto I",Renaissance,Mythology & Folklore,"In travell to and froe: a little wyde
There was an holy Chappell edifyde,
Wherein the Hermite dewly wont to say
His holy things each morne and eventyde:
Thereby a Christall streame did gently play,"
D. H. LAWRENCE,The Wild Common,Modern,Nature,"Plays with me, sways me, lifts me and sinks me as though it were living blood,
Blood of a heaving woman who holds me,
Owning my supple body a rare glad thing, supremely good.
[Version 2: 1928]
The quick sparks on the gorse-bushes are leaping"
CHRISTOPHER MARLOWE,Hero and Leander,Renaissance,Mythology & Folklore,"Much less of powerful gods: let it suffice
That my slack Muse sings of Leander's eyes;
Those orient cheeks and lips, exceeding his
That leapt into the water for a kiss
Of his own shadow, and, despising many,"
JOHN DONNE,Love's Deity,Renaissance,Love,"      His office was indulgently to fit
Actives to passives. Correspondency
Only his subject was; it cannot be
      Love, till I love her, that loves me.
   But every modern god will now extend"
FORD MADOX FORD,In October 1914 [Antwerp],Modern,Mythology & Folklore,"A hundred thousand dragging sunlit days, 
And half October like a thousand years... 
Oh, poor dears!"
JOHN DONNE,The Canonization,Renaissance,Love,"         And if no piece of chronicle we prove,
                We'll build in sonnets pretty rooms;
                As well a well-wrought urn becomes
The greatest ashes, as half-acre tombs,
         And by these hymns, all shall approve"
EDMUND SPENSER,from The Shepheardes Calender: April,Renaissance,Nature,"         She shalbe a grace,
         To fyll the fourth place,
And reigne with the rest in heaven.
And whither rennes this bevie of Ladies bright,
         raunged in a rowe?"
SIR PHILIP SIDNEY,"Astrophil and Stella 47: What, have I thus betrayed my liberty? ",Renaissance,Love,"Leave following that which it is gain to miss.
Let her go. Soft, but here she comes. Go to,
Unkind, I love you not! O me, that eye
Doth make my heart give to my tongue the lie!"
T. S. ELIOT,Portrait of a Lady,Modern,Love,"My feelings, always sure that you feel,
Sure that across the gulf you reach your hand.
You are invulnerable, you have no Achilles' heel.
You will go on, and when you have prevailed
You can say: at this point many a one has failed."
D. H. LAWRENCE,The Wild Common,Modern,Nature,"Are they asleep?  are they living?  Now see, when I
Lift my arms, the hill bursts and heaves under their spurting kick!
The common flaunts bravely; but below, from the rushes
Crowds of glittering king-cups surge to challenge the blossoming bushes;
There the lazy streamlet pushes"
JOHN DONNE,The Relic,Renaissance,Love,"Meet at this grave, and make a little stay?
         If this fall in a time, or land,
         Where mis-devotion doth command,
         Then he, that digs us up, will bring
         Us to the bishop, and the king,"
T. S. ELIOT,Rhapsody on a Windy Night,Modern,Nature,"That cross and cross across her brain.""
The reminiscence comes
Of sunless dry geraniums
And dust in crevices,
Smells of chestnuts in the streets,"
CARL SANDBURG,The Road and the End,Modern,Nature,"The broken boulders by the road
Shall not commemorate my ruin.
Regret shall be the gravel under foot.
I shall watch for
Slim birds swift of wing"
D. H. LAWRENCE,Cruelty and Love ,Modern,Nature,"Into the evening's empty hall.
Oh, water-hen, beside the rushes
Hide your quaint, unfading blushes,
Still your quick tail, and lie as dead,
Till the distance folds over his ominous tread."
WILLIAM SHAKESPEARE,The Phoenix and the Turtle,Renaissance,Mythology & Folklore,"Save the eagle, feather'd king;
Keep the obsequy so strict.
Let the priest in surplice white,
That defunctive music can,
Be the death-divining swan,"
"HENRY HOWARD, EARL OF SURREY",Complaint of the Absence of Her Love Being Upon the Sea,Renaissance,Love,"But when I find the lack, Lord, how I mourn!
When other lovers in arms across
Rejoice their chief delight.
Drowned in tears, to mourn my loss
I stand the bitter night"
LADY MARY WROTH,"from The Countesse of Montgomerys Urania: Love peruse me, seeke, and finde",Renaissance,Love,"Close the Truncke, embalme the Chest,
Where your power still shall rest,
            Joy entombe,
            Loves just doome."
EDMUND SPENSER,Amoretti LXXXIX: Lyke as the Culver on the bared bough,Renaissance,Love,"Whose sweet aspect both God and man can move,
In her unspotted pleasauns to delight.
Dark is my day, whyles her fayre light I mis,
And dead my life that wants such lively blis."
EDMUND SPENSER,from The Shepheardes Calender: April,Renaissance,Nature,"O quam te memorem virgo?
HOBBINOLLS EMBLEME
O dea certe."
HART CRANE,A Name for All,Modern,Nature,"With fin and hoof, with wing and sweetened fang
Struck free and holy in one Name always."
QUEEN ELIZABETH I,On Monsieurs Departure,Renaissance,Love,"No means I find to rid him from my breast,
Till by the end of things it be supprest.
Some gentler passion slide into my mind,
For I am soft and made of melting snow;
Or be more cruel, love, and so be kind."
MARIANNE MOORE,A Graveyard,Modern,Nature,"whose expression is no longer a protest; the fish no longer investigate them
for their bones have not lasted;
men lower nets, unconscious of the fact that they are desecrating a grave,
and row quickly awaythe blades of the oars   
moving together like the feet of water-spiders as if there were no such thing as death."
LOUIS UNTERMEYER,The Victory of the Beet-Fields,Modern,Nature,"We mourn for every leaf that lies,
As though it were a comrade slain;
Each was a shelter from the eyes
Of every prying aeroplane... 
And in its cloudy uniform,"
SIR WALTER RALEGH,Walsinghame,Renaissance,Love,"There is none hath a form so divine
In the earth or the air.
Such an one did I meet, good Sir,
Such an Angelic face,
Who like a queen, like a nymph, did appear"
SIR THOMAS WYATT,The Heart and Service,Renaissance,Love,"And since so much I do desire
To be your own assuredly,
For all my service and my hire
Reward your servant liberally."
SARA TEASDALE,The Old Maid,Modern,Love,"Her soul was frozen in the dark
Unwarmed forever by love's flame.
I felt my lover look at her
And then turn suddenly to me, 
His eyes were magic to defy"
CHRISTOPHER MARLOWE,Hero and Leander,Renaissance,Mythology & Folklore,"Of crystal shining fair the pavement was;
The town of Sestos call'd it Venus' glass:
There might you see the gods in sundry shapes,
Committing heady riots, incest, rapes:
For know, that underneath this radiant flower"
EDMUND SPENSER,from The Shepheardes Calender: April,Renaissance,Mythology & Folklore,"So nowe fayre Rosalind hath bredde hys smart,
So now his frend is chaunged for a frenne.
THENOT
But if hys ditties bene so trimly dight,
I pray thee Hobbinoll, recorde some one:"
THOMAS NASHE,"In Time of Plague [Adieu, farewell, earths bliss]",Renaissance,Love,"All things to end are made,
The plague full swift goes by;
I am sick, I must die.
   Lord, have mercy on us!
Beauty is but a flower"
EDMUND SPENSER,Epithalamion,Renaissance,Mythology & Folklore,"And for the guerdon of theyr glorious merit
May heavenly tabernacles there inherit,
Of blessed Saints for to increase the count.
So let us rest, sweet love, in hope of this,
And cease till then our tymely joyes to sing,"
"HENRY HOWARD, EARL OF SURREY",Wyatt Resteth Here,Renaissance,Love,"Lived, and ran the race that nature set;
Of manhoods shape, where she the mold did lose.
But to the heavens that simple soul is fled,
Which left with such, as covet Christ to know
Witness of faith that never shall be dead:"
EDMUND SPENSER,An Hymn In Honour Of Beauty,Renaissance,Love,"The most resemblance of that heavenly light,
Frame to themselves most beautiful and brave
Their fleshly bower, most fit for their delight,
And the gross matter by a sovereign might
Tempers so trim, that it may well be seen"
JOHN DONNE,A Lecture upon the Shadow,Renaissance,Love,"From us, and our cares; but now tis not so.
That love has not attain'd the high'st degree,
Which is still diligent lest others see.
Except our loves at this noon stay,
We shall new shadows make the other way."
T. S. ELIOT,The Love Song of J. Alfred Prufrock,Modern,Love,"(They will say: How his hair is growing thin!)
My morning coat, my collar mounting firmly to the chin,
My necktie rich and modest, but asserted by a simple pin 
(They will say: But how his arms and legs are thin!)
Do I dare"
EDMUND SPENSER,Epithalamion,Renaissance,Mythology & Folklore,"Be also present heere,
To helpe to decke her and to help to sing,
That all the woods may answer and your eccho ring.
Wake, now my love, awake; for it is time,
The Rosy Morne long since left Tithones bed,"
WALLACE STEVENS,Peter Quince at the Clavier,Modern,Love,"Revealed Susanna and her shame.
And then, the simpering Byzantines
Fled, with a noise like tambourines.
                                             IV
Beauty is momentary in the mind"
EDMUND SPENSER,from The Shepheardes Calender: April,Renaissance,Mythology & Folklore,"         She shalbe a grace,
         To fyll the fourth place,
And reigne with the rest in heaven.
And whither rennes this bevie of Ladies bright,
         raunged in a rowe?"
RICHARD BARNFIELD,Sonnet 16,Renaissance,Love,"Weening to kisse his lips, as my loves fees,
I feele but aire: nothing but aire to bee him.
Thus with Ixion, kisse I clouds in vaine:
Thus with Ixion, feele I endles paine."
EDMUND SPENSER,An Hymn In Honour Of Beauty,Renaissance,Love,"An outward shew of things, that only seem.
For that same goodly hue of white and red,
With which the cheeks are sprinkled, shall decay,
And those sweet rosy leaves, so fairly spread
Upon the lips, shall fade and fall away"
JOHN DONNE,Of the Progress of the Soul: The Second Anniversary,Renaissance,Nature,"Than those thy fellow-worms do think upon
That carcass's last resurrection?
Forget this world, and scarce think of it so,
As of old clothes, cast off a year ago.
To be thus stupid is alacrity;"
WALLACE STEVENS,Thirteen Ways of Looking at a Blackbird,Modern,Nature,"Would cry out sharply.   
XI
He rode over Connecticut   
In a glass coach.   
Once, a fear pierced him,   "
JOHN DONNE,The Ecstasy,Renaissance,Nature,"They'are ours, though they'are not we; we are
         The intelligences, they the spheres.
We owe them thanks, because they thus
         Did us, to us, at first convey,
Yielded their senses' force to us,"
JOHN DONNE,The Apparition,Renaissance,Mythology & Folklore,"And then, poor aspen wretch, neglected thou
Bath'd in a cold quicksilver sweat wilt lie
         A verier ghost than I.
What I will say, I will not tell thee now,
Lest that preserve thee; and since my love is spent,"
EDMUND SPENSER,Prothalamion,Renaissance,Nature,"'Ye gentle birds, the world's fair ornament,
And heaven's glory, whom this happy hour
Doth lead unto your lovers' blissful bower,
Joy may you have and gentle heart's content
Of your love's complement:"
CHRISTOPHER MARLOWE,Hero and Leander,Renaissance,Mythology & Folklore,"         Amorous Leander, beautiful and young
(Whose tragedy divine Musus sung),
Dwelt at Abydos; since him dwelt there none
For whom succeeding times make greater moan.
His dangling tresses, that were never shorn,"
EDMUND SPENSER,from The Shepheardes Calender: April,Renaissance,Nature,"Nor thys, nor that, so muche doeth make me mourne,
But for the ladde, whome long I lovd so deare,
Nowe loves a lasse, that all his love doth scorne:
He plongd in payne, his tressed locks dooth teare.
Shepheards delights he dooth them all forsweare,"
EDMUND SPENSER,An Hymn In Honour Of Beauty,Renaissance,Love,"That base affections, which your ears would bland,
Commend to you by love's abused name,
But is indeed the bondslave of defame;
Which will the garland of your glory mar,
And quench the light of your bright shining star."
EDMUND SPENSER,from The Shepheardes Calender: October,Renaissance,Nature,"And lyftes him up out of the loathsome myre:
Such immortall mirrhor, as he doth admire,
Would rayse ones mynd above the starry skie.
And cause a caytive corage to aspire,
For lofty love doth loath a lowly eye."
ELINOR WYLIE,Full Moon,Modern,Nature,"Shouldering the thoughts I loathed,
In their corrupt disguises clothed,
Morality I could not tear
From my ribs, to leave them bare
Ivory in silver air."
EDMUND SPENSER,Prosopopoia: or Mother Hubbard's Tale,Renaissance,Mythology & Folklore,"Then to some nobleman yourself apply,
Or other great one in the worldes eye,
That hath a zealous disposition
To God, and so to his religion.
There must thou fashion eke a godly zeal,"
WILLIAM SHAKESPEARE,Sonnet 20: A womans face with natures own hand painted,Renaissance,Love,"And by addition me of thee defeated
By adding one thing to my purpose nothing.
      But since she pricked thee out for women's pleasure,
      Mine be thy love and thy loves use their treasure."
D. H. LAWRENCE,The Enkindled Spring,Modern,Nature,"About like a shadow buffeted in the throng
Of flames, a shadow that's gone astray, and is lost."
RICHARD ALDINGTON,To a Greek Marble,Modern,Love,"Of our loves in Phrygia,
The far ecstasy of burning noons
When the fragile pipes
Ceased in the cypress shade,
And the brown fingers of the shepherd"
WILLIAM SHAKESPEARE,Sonnet 1: From fairest creatures we desire increase,Renaissance,Love,"Within thine own bud buriest thy content,
And, tender churl, makst waste in niggarding.
   Pity the world, or else this glutton be,
   To eat the worlds due, by the grave and thee."
WILLIAM SHAKESPEARE,The Phoenix and the Turtle,Renaissance,Love,"Save the eagle, feather'd king;
Keep the obsequy so strict.
Let the priest in surplice white,
That defunctive music can,
Be the death-divining swan,"
LOUIS UNTERMEYER,Magic,Modern,Mythology & Folklore,"Happy to move about a spirit quite
As old, as placid and as confident...
Sideways we turned. Still glistening and unclad
He leaped up on the bank, light as a lad,
His body in the moonlight dripping stars..."
