author,poem name,age,type,question
EDMUND SPENSER,An Hymn In Honour Of Beauty,Renaissance,Love,"Which they have harbour'd since their first descent
Out of their heavenly bowers, where they did see
And know each other here belov'd to be.
Then wrong it were that any other twain
Should in love's gentle band combined be"
D. H. LAWRENCE,Almond Blossom,Modern,Nature,"Fearing nothing, life-blissful at the core
Within iron and earth.
Knots of pink, fish-silvery
In heaven, in blue, blue heaven,
Soundless, bliss-full, wide-rayed, honey-bodied,"
EDMUND SPENSER,"from The Faerie Queene: Book I, Canto I",Renaissance,Mythology & Folklore,"Seemd in their song to scorne the cruell sky.
Much can they prayse the trees so straight and hy,
The sayling Pine, the Cedar proud and tall,
The vine-prop Elme, the Poplar never dry,
The builder Oake, sole king of forrests all,"
CHRISTOPHER MARLOWE,Hero and Leander,Renaissance,Mythology & Folklore,"Her wide sleeves green, and border'd with a grove,
Where Venus in her naked glory strove
To please the careless and disdainful eyes
Of proud Adonis, that before her lies;
Her kirtle blue, whereon was many a stain,"
EDMUND SPENSER,from The Shepheardes Calender: October,Renaissance,Nature,"Indeed the Romish Tityrus, I heare,
Through his Mecoenas left his Oaten reede,
Whereon he earst had taught his flocks to feede,
And laboured lands to yield the timely eare,
And eft did sing of warres and deadly drede,"
JOHN DONNE,Elegy IX: The Autumnal,Renaissance,Nature,"Here where still evening is, not noon nor night,
         Where no voluptuousness, yet all delight.
In all her words, unto all hearers fit,
         You may at revels, you at council, sit.
This is Love's timber, youth his underwood;"
HART CRANE,For The Marriage of Faustus and Helen,Modern,Mythology & Folklore,"We cannot frown upon her as she smiles,
Dipping here in this cultivated storm
Among slim skaters of the gardened skies.
       III
Capped arbiter of beauty in this street"
LOUISE BOGAN,A Tale,Modern,Love,"A land with hills like rocky gates
Where no sea leaps upon itself.
But he will find that nothing dares
To be enduring, save where, south
Of hidden deserts, torn fire glares"
EDMUND SPENSER,from The Shepheardes Calender: October,Renaissance,Mythology & Folklore,"PIERS
Abandon then the base and viler clowne,
Lyft up thy selfe out of the lowly dust:
And sing of bloody Mars, of wars, of giusts.
Turne thee to those, that weld the awful crowne,"
EDMUND SPENSER,Epithalamion,Renaissance,Mythology & Folklore,"And in thy sable mantle us enwrap,
From feare of perrill and foule horror free.
Let no false treason seeke us to entrap,
Nor any dread disquiet once annoy
The safety of our joy:"
T. S. ELIOT,Portrait of a Lady,Modern,Love,"Why we have not developed into friends.""
I feel like one who smiles, and turning shall remark
Suddenly, his expression in a glass.
My self-possession gutters; we are really in the dark.
""For everybody said so, all our friends,"
T. S. ELIOT,Preludes,Modern,Nature,"Of which your soul was constituted;
They flickered against the ceiling.
And when all the world came back
And the light crept up between the shutters
And you heard the sparrows in the gutters,"
JOHN DONNE,The Dream,Renaissance,Love,"   As lightning, or a taper's light,
Thine eyes, and not thy noise wak'd me;
            Yet I thought thee
(For thou lovest truth) an angel, at first sight;
But when I saw thou sawest my heart,"
EDMUND SPENSER,from The Shepheardes Calender: April,Renaissance,Mythology & Folklore,"All for Elisa in her hand to weare?
         So sweetely they play,
         And sing all the way,
That it a heaven is to heare.
Lo how finely the graces can it foote"
EDMUND SPENSER,from The Shepheardes Calender: April,Renaissance,Nature,"Ys love such pinching payne to them, that prove?
And hath he skill to make so excellent,
Yet hath so little skill to brydle love?
HOBBINOLL
Colin thou kenst, the Southerne shepheardes boye:"
D. H. LAWRENCE,Gloire de Dijon,Modern,Nature,"She drips herself with water, and her shoulders
Glisten as silver, they crumple up
Like wet and falling roses, and I listen
For the sluicing of their rain-dishevelled petals.
In the window full of sunlight"
D. H. LAWRENCE,Almond Blossom,Modern,Nature,"In the distance like hoar-frost, like silvery ghosts communing on a green hill,
Hoar-frost-like and mysterious.
In the garden raying out
With a body like spray, dawn-tender, and looking about
With such insuperable, subtly-smiling assurance,"
SARA TEASDALE,Since There Is No Escape,Modern,Nature,"In pride, and let me sing with my last breath;
In these few hours of light I lift my head;
Life is my loverI shall leave the dead
If there is any way to baffle death."
WILLIAM BUTLER YEATS,The Song of the Happy Shepherd,Modern,Nature,"Where are now the warring kings,
Word be-mockers?  By the Rood
Where are now the warring kings?
An idle word is now their glory,
By the stammering schoolboy said,"
E. E. CUMMINGS,[in Just-],Modern,Mythology & Folklore,"balloonMan          whistles
far
and
wee"
EN JONSON,"Though I am young, and cannot tell",Renaissance,Love,"Or to our end like way may have
    By a flash of lightning, or a wave;
So Loves inflamed shaft or brand
    May kill as soon as Deaths cold hand;
Except Loves fires the virtue have"
"SECOND BARON VAUX OF HARROWDEN THOMAS, LORD VAUX",The Aged Lover Renounceth Love,Renaissance,Love,"And shipped me into the land
From whence I first was brought.
And ye that bide behind,
Have ye none other trust:
As ye of clay were cast by kind,"
EDMUND SPENSER,"from The Faerie Queene: Book I, Canto I",Renaissance,Mythology & Folklore,"Sweet slombring deaw, the which to sleepe them biddes.
Unto their lodgings then his guestes he riddes:
Where when all drownd in deadly sleepe he findes,
He to his study goes, and there amiddes
His Magick bookes and artes of sundry kindes,"
WILLIAM SHAKESPEARE,from The Rape of Lucrece,Renaissance,Love,"With pearly sweat resembling dew of night.
Her eyes, like marigolds, had sheathed their light,
And canopied in darkness sweetly lay
Till they might open to adorn the day.
Her hair like golden threads played with her breath"
EDMUND SPENSER,Prothalamion,Renaissance,Mythology & Folklore,"And mar their beauties bright,
That shone as heaven's light,
Against their bridal day, which was not long:
      Sweet Thames, run softly, till I end my song.
Eftsoons the nymphs, which now had flowers their fill,"
RICHARD ALDINGTON,Au Vieux Jardin,Modern,Nature,"And the pale yellow grasses
Among them."
EDMUND SPENSER,from The Shepheardes Calender: April,Renaissance,Mythology & Folklore,"Ys love such pinching payne to them, that prove?
And hath he skill to make so excellent,
Yet hath so little skill to brydle love?
HOBBINOLL
Colin thou kenst, the Southerne shepheardes boye:"
EDMUND SPENSER,"from The Faerie Queene: Book I, Canto I",Renaissance,Mythology & Folklore,"Whose loftie trees yclad with sommers pride,
Did spred so broad, that heavens light did hide,
Not perceable with power of any starre:
And all within were pathes and alleies wide,
With footing worne, and leading inward farre:"
WILLIAM SHAKESPEARE,"Sonnet 135: Whoever hath her wish, thou hast thy Will",Renaissance,Love,"So thou being rich in Will add to thy Will
One will of mine, to make thy large Will more.
   Let no unkind, no fair beseechers kill;
   Think all but one, and me in that one Will."
EDMUND SPENSER,"from The Faerie Queene: Book I, Canto I",Renaissance,Mythology & Folklore,"Amid the bowels of the earth full steepe,
And low, where dawning day doth never peepe,
His dwelling is; there Tethys his wet bed
Doth ever wash, and Cynthia still doth steepe
In silver deaw his ever-drouping hed,"
EDMUND SPENSER,from The Shepheardes Calender: October,Renaissance,Mythology & Folklore,"Or if thee please in bigger notes to sing,
Advaunce the worthy whome shee loveth best,
That first the white beare to the stake did bring.
And when the stubborne stroke of stronger stounds,
Has somewhat slackt the tenor of thy string:"
WILLIAM BUTLER YEATS,The Song of Wandering Aengus,Modern,Love,"And walk among long dappled grass,
And pluck till time and times are done,
The silver apples of the moon,
The golden apples of the sun."
EN JONSON,"A Sonnet to the Noble Lady, the Lady Mary Wroth",Renaissance,Love,"His very eyes are yours to overthrow.
But then his mothers sweets you so apply,
Her joys, her smiles, her loves, as readers take
For Venus ceston every line you make."
GUILLAUME APOLLINAIRE,Ocean of Earth,Modern,Nature,"Watch out for the shooting black ichor
It would be good if you were to come from the sky
The skys honeysuckle is climbing
The earthly octopi are throbbing
And so very many of us have become our own gravediggers"
WILLIAM BUTLER YEATS,The Song of the Happy Shepherd,Modern,Nature,"Troubling the endless reverie.
Then nowise worship dusty deeds,
Nor seek, for this is also sooth,
To hunger fiercely after truth,
Lest all thy toiling only breeds"
WILLIAM SHAKESPEARE,from The Rape of Lucrece,Renaissance,Love,"His eye commends the leading to his hand;
His hand, as proud of such a dignity,
Smoking with pride, marched on to make his stand
On her bare breast, the heart of all her land,
Whose ranks of blue veins, as his hand did scale,"
EDMUND SPENSER,Prothalamion,Renaissance,Nature,"Along the shore of silver streaming Thames,
Whose rutty bank, the which his river hems,
Was painted all with variable flowers,
And all the meads adorned with dainty gems,
Fit to deck maidens' bowers,"
RICHARD ALDINGTON,To a Greek Marble,Modern,Love,"And thou hearest me not,
Potuia, potuia
Thou hearest me not."
HART CRANE,For The Marriage of Faustus and Helen,Modern,Mythology & Folklore,"Blest excursion! this ricochet
From roof to roof
Know, Olympians, we are breathless
While nigger cupids scour the stars!
A thousand light shrugs balance us"
SIR WALTER RALEGH,The Nymphs Reply to the Shepherd,Renaissance,Nature,"But could youth last, and love still breed,
Had joys no date, nor age no need,
Then these delights my mind might move
To live with thee, and be thy love."
EDMUND SPENSER,"from The Faerie Queene: Book I, Canto I",Renaissance,Mythology & Folklore,"From turning backe, and forced her to stay:
Therewith enrag'd she loudly gan to bray,
And turning fierce, her speckled taile advaunst,
Threatning her angry sting, him to dismay:
Who nought aghast, his mightie hand enhaunst:"
HART CRANE,Repose of Rivers,Modern,Nature,"Asunder...
How much I would have bartered! the black gorge
And all the singular nestings in the hills
Where beavers learn stitch and tooth.
The pond I entered once and quickly fled"
JOHN DONNE,The Flea,Renaissance,Love,"Wherein could this flea guilty be,
Except in that drop which it sucked from thee?   
Yet thou triumphst, and say'st that thou   
Findst not thy self, nor me the weaker now;
    Tis true; then learn how false, fears be:"
T. S. ELIOT,Portrait of a Lady,Modern,Love,"Then sit for half an hour and drink our bocks.
II
Now that lilacs are in bloom
She has a bowl of lilacs in her room
And twists one in her fingers while she talks."
RICHARD BARNFIELD,Sonnet 17,Renaissance,Love,"    Where Muses (like bees) make their mansion.
His teeth pure pearle in blushing correll set.
    Oh how can such a body sinne-procuring,
    Be slow to love, and quicke to hate, enduring?"
WILLIAM SHAKESPEARE,Song: When daisies pied and violets blue ,Renaissance,Nature,"And Tom bears logs into the hall,
      And milk comes frozen home in pail,
When blood is nipp'd, and ways be foul,
Then nightly sings the staring-owl,
                                                    Tu-who;"
EDMUND SPENSER,"from The Faerie Queene: Book I, Canto I",Renaissance,Mythology & Folklore,"Ne ever would to any by-way bend,
But still did follow one unto the end,
The which at last out of the wood them brought.
So forward on his way (with God to frend)
He passed forth, and new adventure sought;"
JOHN DONNE,Lovers' Infiniteness,Renaissance,Love,"But we will have a way more liberal,
Than changing hearts, to join them; so we shall
         Be one, and one another's all."
IVOR GURNEY,Strange Service,Modern,Mythology & Folklore,"Muddy and strongly flowing, with shy and tiny streamlets
Safe in its bosom.
Now these are memories only, and your skies and rushy sky-pools
Fragile mirrors easily broken by moving airs...
But deep in my heart for ever goes on your daily being,"
D. H. LAWRENCE,Tortoise Gallantry,Modern,Love,"Suddenly, or her skinny limb,
And strange and grimly drags at her
Like a dog,
Only agelessly silent, with a reptile's awful persistency.
Grim, gruesome gallantry, to which he is doomed."
EDMUND SPENSER,Amoretti I: Happy ye leaves when as those lilly hands,Renaissance,Love,"When ye behold that Angels blessed looke,
My soules long lacked foode, my heavens blis.
Leaves, lines, and rymes, seeke her to please alone,
Whom if ye please, I care for other none. "
SIR PHILIP SIDNEY,The Nightingale,Renaissance,Love,"Thine earth now springs, mine fadeth;
Thy thorn without, my thorn my heart invadeth.
Alas, she hath no other cause of anguish
But Tereus love, on her by strong hand wroken,
Wherein she suffering, all her spirits languish;"
D. H. LAWRENCE,Tortoise Gallantry,Modern,Love,"Born to walk alone,
Forerunner,
Now suddenly distracted into this mazy side-track,
This awkward, harrowing pursuit,
This grim necessity from within."
JOHN DONNE,Song: Go and catch a falling star,Renaissance,Love,"Yet do not, I would not go,
    Though at next door we might meet;
Though she were true, when you met her,
And last, till you write your letter,
            Yet she"
HART CRANE,from The Bridge: Southern Cross,Modern,Love,"Whatever callfalls vainly on the wave.
O simian Venus, homeless Eve,
Unwedded, stumbling gardenless to grieve
Windswept guitars on lonely decks forever;
Finally to answer all within one grave!"
MARIANNE MOORE,Black Earth,Modern,Nature,"         Out childhood to the present time, the unity of
         Life and death has been expressed by the circumference
Described by my
Trunk; nevertheless, I
         Perceive feats of strength to be inexplicable after"
RICHARD ALDINGTON,,Modern,Nature,"Over long leagues of lonely sea;
Thou art the dusk and the fragrance;
Thou art the lips of love mournfully smiling;
Thou art the pale peace of one
Satiate with old desires;"
EDMUND SPENSER,from The Shepheardes Calender: October,Renaissance,Mythology & Folklore,"Or it mens follies mote be forst to fayne,
And rolle with rest in rymes of rybaudrye:
Or as it sprong, it wither must agayne:
Tom Piper makes us better melodie.
PIERS"
SARA TEASDALE,Since There Is No Escape,Modern,Love,"In pride, and let me sing with my last breath;
In these few hours of light I lift my head;
Life is my loverI shall leave the dead
If there is any way to baffle death."
WILLIAM BUTLER YEATS,The Cap and Bells,Modern,Love,"To her right hand came the red one,
To her left hand came the blue.
They set up a noise like crickets,
A chattering wise and sweet,
And her hair was a folded flower"
WILLIAM SHAKESPEARE,"Sonnet 57: Being your slave, what should I do but tend",Renaissance,Love,"But like a sad slave, stay and think of nought,
Save, where you are how happy you make those.
So true a fool is love that in your will
Though you do anything, he thinks no ill."
D. H. LAWRENCE,Tortoise Gallantry,Modern,Love,"And the still more awful need to persist, to follow, follow, continue,
Driven, after ons of pristine, fore-god-like singleness and oneness,
At the end of some mysterious, red-hot iron,
Driven away from himself into her tracks,
Forced to crash against her."
RICHARD ALDINGTON,,Modern,Nature,"Thou crownest us with the pallid chaplets,
The slim colorless poppies
Which in thy garden alone
Softly thou gatherest.
And silently;"
SIR THOMAS WYATT,And Wilt thou Leave me Thus?,Renaissance,Love,"Of him that loveth thee?
Helas, thy cruelty!
And wilt thou leave me thus?
Say nay, say nay!"
EDMUND SPENSER,Prothalamion,Renaissance,Mythology & Folklore,"That they appear through lilies' plenteous store,
Like a bride's chamber floor.
Two of those nymphs meanwhile, two garlands bound,
Of freshest flowers which in that mead they found,
The which presenting all in trim array,"
SIR PHILIP SIDNEY,Ring Out Your Bells,Renaissance,Love,"Weep, neighbours, weep; do you not hear it said
That Love is dead?
His death-bed, peacock's folly;
His winding-sheet is shame;
His will, false-seeming holy;"
D. H. LAWRENCE,Last Words to Miriam,Modern,Love,"Mine was the love of a growing flower
For the sunshine.
You had the power to explore me,
Blossom me stalk by stalk;
You woke my spirit, you bore me"
EDMUND SPENSER,Prothalamion,Renaissance,Mythology & Folklore,"Let endless peace your steadfast hearts accord,
And blessed plenty wait upon your board,
And let your bed with pleasures chaste abound,
That fruitful issue may to you afford,
Which may your foes confound,"
WILLIAM SHAKESPEARE,"Sonnet 107: Not mine own fears, nor the prophetic soul",Renaissance,Love,"Since, spite of him, I'll live in this poor rhyme,
While he insults o'er dull and speechless tribes;
And thou in this shalt find thy monument,
When tyrants' crests and tombs of brass are spent."
WALLACE STEVENS,Peter Quince at the Clavier,Modern,Love,"So gardens die, their meek breath scenting
The cowl of winter, done repenting.
So maidens die, to the auroral
Celebration of a maiden's choral.
Susanna's music touched the bawdy strings"
EDMUND SPENSER,Prosopopoia: or Mother Hubbard's Tale,Renaissance,Mythology & Folklore,"A visitation, and them cited thether:
Then was high time their wits about to geather.
What did they then, but made a composition
With their next neighbour priest, for light condition,
To whom their living they resigned quite"
WILLIAM BUTLER YEATS,On a Political Prisoner,Modern,Nature,"Blind and leader of the blind
Drinking the foul ditch where they lie?
When long ago I saw her ride
Under Ben Bulben to the meet,
The beauty of her country-side"
CARL SANDBURG,Wilderness,Modern,Nature," before Noah
 before the first chapter of Genesis.
There is a baboon in me
 clambering-clawed
 dog-faced"
D. H. LAWRENCE,Cruelty and Love ,Modern,Nature,"I only know I let him finger there
My pulse of life, letting him nose like a stoat
Who sniffs with joy before he drinks the blood:
And down his mouth comes to my mouth, and down
His dark bright eyes descend like a fiery hood"
EDMUND SPENSER,Epithalamion,Renaissance,Mythology & Folklore,"How slowly does sad Time his feathers move?
Hast thee O fayrest Planet to thy home
Within the Westerne fome:
Thy tyred steedes long since have need of rest.
Long though it be, at last I see it gloome,"
SIR WALTER RALEGH,Praisd be Dianas Fair and Harmless Light,Renaissance,Nature,"Eternity in her oft change she bears;
She beauty is; by her the fair endure.
Time wears her not: she doth his chariot guide;
Mortality below her orb is placd;
By her the virtue of the stars down slide;"
WILLIAM BUTLER YEATS,The Song of the Happy Shepherd,Modern,Nature,"Till they shall singing fade in ruth
And die a pearly brotherhood;
For words alone are certain good:
Sing, then, for this is also sooth.
I must be gone: there is a grave"
EDMUND SPENSER,Epithalamion,Renaissance,Mythology & Folklore,"And unrevealed pleasures,
Then would ye wonder and her prayses sing,
That al the woods should answer and your eccho ring.
Open the temple gates unto my love,
Open them wide that she may enter in,"
"HENRY HOWARD, EARL OF SURREY",Complaint of the Absence of Her Love Being Upon the Sea,Renaissance,Love,"My life while it will last;
With scalding sighs, for lack of gale,
Furthering his hope, that is his sail,
Toward me, the sweet port of his avail.
Alas! how oft in dreams I see"
ISABELLA WHITNEY,"A Communication Which the Author Had to London, Before She Made Her Will",Renaissance,Love,"Thou never yet wouldst credit give
   to board me for a year;
Nor with apparel me relieve,
   except thou payed were.
No, no, thou never didst me good,"
PAUL LAURENCE DUNBAR,The Old Front Gate,Modern,Love,"You kin reckon dat hit's time
Fu' to cas' yo' eye erroun',
'Cause daih ain't no sputin' dis,
Hit's de trues' sign to show
Dat daih's cou'tin goin' on"
SIR PHILIP SIDNEY,"Astrophil and Stella 33: I might!unhappy wordO me, I might",Renaissance,Love,"That I respects for both our sakes must show:
And yet could not by rising morn foresee
How fair a day was near: O punish'd eyes,
That I had been more foolish,or more wise!"
T. S. ELIOT,Preludes,Modern,Nature,"In the palms of both soiled hands.
IV
His soul stretched tight across the skies
That fade behind a city block,
Or trampled by insistent feet"
SIR THOMAS WYATT,My Lute Awake,Renaissance,Love,"Vengeance shall fall on thy disdain
That makest but game on earnest pain.
Think not alone under the sun
Unquit to cause thy lovers plain,
Although my lute and I have done."
EDMUND SPENSER,Epithalamion,Renaissance,Mythology & Folklore,"Their prety stelthes shal worke, and snares shal spread
To filch away sweet snatches of delight,
Conceald through covert night.
Ye sonnes of Venus, play your sports at will,
For greedy pleasure, carelesse of your toyes,"
EDMUND SPENSER,"from The Faerie Queene: Book I, Canto I",Renaissance,Mythology & Folklore,"His heavie head, devoide of carefull carke,
Whose sences all were straight benumbed and starke.
He backe returning by the Yvorie dore,
Remounted up as light as chearefull Larke,
And on his litle winges the dreame he bore"
EDMUND SPENSER,Prosopopoia: or Mother Hubbard's Tale,Renaissance,Mythology & Folklore,"But, ere long time had passed, they so ill
Did order their affairs, that th' evil will
Of all their parish'ners they had constrain'd;
Who to the Ordinary of them complain'd,
How foully they their offices abus'd,"
SIR PHILIP SIDNEY,"Astrophil and Stella 14: Alas, have I not pain enough, my friend",Renaissance,Love,"Ready of wit, and fearing naught but shame;
If that be sin which in fixed hearts doth breed
A loathing of all loose unchastity,
Then love is sin, and let me sinful be."
D. H. LAWRENCE,Tortoise Shout,Modern,Love,"After each jerk, the longish interval,
The tortoise eternity,
Agelong, reptilian persistence,
Heart-throb, slow heart-throb, persistent for the next spasm.
I remember, when I was a boy,"
EDMUND SPENSER,The Shepheardes Calender: January,Renaissance,Nature,"For pale and wanne he was, (alas the while,)
May seeme he lovd, or els some care he tooke:
Well couth he tune his pipe, and frame his stile.
Tho to a hill his faynting flocke he ledde,
And thus him playnd, the while his shepe there fedde."
T. S. ELIOT,The Love Song of J. Alfred Prufrock,Modern,Love,"Oh, do not ask, What is it?
Let us go and make our visit.
In the room the women come and go
Talking of Michelangelo.
The yellow fog that rubs its back upon the window-panes,"
JOHN DONNE,The Indifferent,Renaissance,Love,"She heard not this till now; and that it should be so no more.
She went, examined, and returned ere long,
And said, Alas! some two or three
Poor heretics in love there be,
Which think to stablish dangerous constancy."
ELINOR WYLIE,Wild Peaches,Modern,Love,"The sun, which burns from copper into brass,
Melts these at noon, and makes the boys unfold
Their knitted mufflers; full as they can hold
Fat pockets dribble chestnuts as they pass.
Peaches grow wild, and pigs can live in clover;"
PAUL LAURENCE DUNBAR,The Haunted Oak,Modern,Nature,"Oh, the judge, he wore a mask of black,
   And the doctor one of white,
And the minister, with his oldest son,
   Was curiously bedight.
Oh, foolish man, why weep you now?"
EDMUND SPENSER,"from The Faerie Queene: Book I, Canto I",Renaissance,Mythology & Folklore,"At that good knight so cunningly didst rove,
That glorious fire it kindled in his hart,
Lay now thy deadly Heben bow apart,
And with thy mother milde come to mine ayde:
Come both, and with you bring triumphant Mart,"
WILLIAM BUTLER YEATS,The Song of Wandering Aengus,Modern,Love,"But something rustled on the floor,
And someone called me by my name:
It had become a glimmering girl
With apple blossom in her hair
Who called me by my name and ran"
EDMUND SPENSER,"from The Faerie Queene: Book I, Canto I",Renaissance,Mythology & Folklore,"Who see your vanquisht foes before you lye:
Well worthy be you of that Armorie,
Wherein ye have great glory wonne this day,
And proov'd your strength on a strong enimie,
Your first adventure: many such I pray,"
THOMAS NASHE,"In Time of Plague [Adieu, farewell, earths bliss]",Renaissance,Love,"Hells executioner
Hath no ears for to hear
What vain art can reply.
I am sick, I must die.
   Lord, have mercy on us."
CHRISTOPHER MARLOWE,Hero and Leander,Renaissance,Love,"And one especially do we affect
Of two gold ingots, like in each respect:
The reason no man knows, let it suffice,
What we behold is censur'd by our eyes.
Where both deliberate, the love is slight:"
JOHN DONNE,The Ecstasy,Renaissance,Nature,"Love's mysteries in souls do grow,
         But yet the body is his book.
And if some lover, such as we,
         Have heard this dialogue of one,
Let him still mark us, he shall see"
EDMUND SPENSER,from The Shepheardes Calender: April,Renaissance,Nature,"Which once he made, as by a spring he laye,
And tuned it unto the Waters fall.
Ye dayntye Nymphs, that in this blessed Brooke
         doe bathe your brest,
Forsake your watry bowres, and hether looke,"
D. H. LAWRENCE,Bat,Modern,Nature,"A twitch, a twitter, an elastic shudder in flight
And serrated wings against the sky,
Like a glove, a black glove thrown up at the light,
And falling back.
Never swallows!"
EDMUND SPENSER,An Hymn In Honour Of Beauty,Renaissance,Love,"Thereof he fashions in his higher skill
An heavenly beauty to his fancy's will;
And it embracing in his mind entire,
The mirror of his own thought doth admire.
Which seeing now so inly fair to be,"
